{
  "updated": "2026-03-09",
  "gemini": [
    {
      "name": "gemini-2.0-flash-lite",
      "input": 0.075,
      "output": 0.3,
      "cachedInput": null
    },
    {
      "name": "gemini-2.0-flash",
      "input": 0.1,
      "output": 0.4,
      "cachedInput": null
    },
    {
      "name": "gemini-2.5-flash",
      "input": 0.3,
      "output": 2.5,
      "cachedInput": null
    },
    {
      "name": "gemini-2.5-flash-(thinking)",
      "input": 0.15,
      "output": 3.5,
      "cachedInput": null
    },
    {
      "name": "gemini-2.5-pro",
      "input": 1.25,
      "output": 10,
      "cachedInput": null
    },
    {
      "name": "gemini-pro",
      "input": 0.5,
      "output": 1.5,
      "cachedInput": null
    },
    {
      "name": "gemini-1.0-pro",
      "input": 0.5,
      "output": 1.5,
      "cachedInput": null
    },
    {
      "name": "gemini-1.0-ultra",
      "input": 0.5,
      "output": 1.5,
      "cachedInput": null
    },
    {
      "name": "gemini-1.0-ultra-001",
      "input": 0.5,
      "output": 1.5,
      "cachedInput": null
    },
    {
      "name": "gemini-1.5-pro",
      "input": 3.5,
      "output": 10.5,
      "cachedInput": null
    },
    {
      "name": "gemini-1.5-pro-002",
      "input": 1.25,
      "output": 5,
      "cachedInput": null
    },
    {
      "name": "gemini-1.5-pro-preview-0514",
      "input": 0.0781,
      "output": 0.3125,
      "cachedInput": null
    },
    {
      "name": "gemini-1.5-pro-preview-0215",
      "input": 0.0781,
      "output": 0.3125,
      "cachedInput": null
    },
    {
      "name": "gemini-1.5-pro-preview-0409",
      "input": 0.0781,
      "output": 0.3125,
      "cachedInput": null
    },
    {
      "name": "gemini-1.5-flash",
      "input": 0.075,
      "output": 0.3,
      "cachedInput": null
    },
    {
      "name": "gemini-1.5-flash-exp-0827",
      "input": 0.0047,
      "output": 0.0047,
      "cachedInput": null
    },
    {
      "name": "gemini-1.5-flash-002",
      "input": 0.075,
      "output": 0.3,
      "cachedInput": null
    },
    {
      "name": "gemini-1.5-flash-preview-0514",
      "input": 0.075,
      "output": 0.0047,
      "cachedInput": null
    },
    {
      "name": "gemini-pro-vision",
      "input": 0.5,
      "output": 1.5,
      "cachedInput": null
    },
    {
      "name": "gemini-1.0-pro-vision",
      "input": 0.5,
      "output": 1.5,
      "cachedInput": null
    },
    {
      "name": "gemini-2.5-pro-exp-03-25",
      "input": 1.25,
      "output": 10,
      "cachedInput": null
    },
    {
      "name": "gemini-2.0-pro-exp-02-05",
      "input": 1.25,
      "output": 10,
      "cachedInput": null
    },
    {
      "name": "gemini-2.0-flash-exp",
      "input": 0.15,
      "output": 0.6,
      "cachedInput": null
    },
    {
      "name": "gemini-2.0-flash-001",
      "input": 0.15,
      "output": 0.6,
      "cachedInput": null
    },
    {
      "name": "gemini-2.5-pro",
      "input": 1.25,
      "output": 10,
      "cachedInput": null
    },
    {
      "name": "gemini-2.5-flash",
      "input": 0.3,
      "output": 2.5,
      "cachedInput": null
    },
    {
      "name": "gemini-2.5-flash-image-preview",
      "input": 0.3,
      "output": 30,
      "cachedInput": null
    },
    {
      "name": "gemini-2.0-flash-live-001",
      "input": 0.35,
      "output": 1.5,
      "cachedInput": null
    },
    {
      "name": "gemini-2.5-flash-preview-tts",
      "input": 0.3,
      "output": 2.5,
      "cachedInput": null
    },
    {
      "name": "gemini-2.5-flash-preview-05-20",
      "input": 0.3,
      "output": 2.5,
      "cachedInput": null
    },
    {
      "name": "gemini-2.5-flash-preview-04-17",
      "input": 0.15,
      "output": 0.6,
      "cachedInput": null
    },
    {
      "name": "gemini-2.5-flash-lite-preview-06-17",
      "input": 0.1,
      "output": 0.4,
      "cachedInput": null
    },
    {
      "name": "gemini-2.5-flash-lite",
      "input": 0.1,
      "output": 0.4,
      "cachedInput": null
    },
    {
      "name": "gemini-2.5-flash-image-preview",
      "input": 0.3,
      "output": 30,
      "cachedInput": null
    },
    {
      "name": "gemini-2.5-flash-preview-05-20",
      "input": 0.3,
      "output": 2.5,
      "cachedInput": null
    },
    {
      "name": "gemini-2.5-flash-preview-04-17",
      "input": 0.15,
      "output": 0.6,
      "cachedInput": null
    },
    {
      "name": "gemini-2.5-flash-lite-preview-06-17",
      "input": 0.1,
      "output": 0.4,
      "cachedInput": null
    },
    {
      "name": "gemini-2.5-flash-lite",
      "input": 0.1,
      "output": 0.4,
      "cachedInput": null
    },
    {
      "name": "gemini-2.0-flash-lite-001",
      "input": 0.075,
      "output": 0.3,
      "cachedInput": null
    },
    {
      "name": "gemini-2.5-pro-preview-06-05",
      "input": 1.25,
      "output": 10,
      "cachedInput": null
    },
    {
      "name": "gemini-2.5-pro-preview-05-06",
      "input": 1.25,
      "output": 10,
      "cachedInput": null
    },
    {
      "name": "gemini-2.5-pro-preview-03-25",
      "input": 1.25,
      "output": 10,
      "cachedInput": null
    },
    {
      "name": "gemini-2.0-flash-preview-image-generation",
      "input": 0.1,
      "output": 0.4,
      "cachedInput": null
    },
    {
      "name": "gemini-2.5-pro-preview-tts",
      "input": 1.25,
      "output": 10,
      "cachedInput": null
    },
    {
      "name": "gemini-2.0-flash-preview-image-generation",
      "input": 0.1,
      "output": 0.4,
      "cachedInput": null
    },
    {
      "name": "gemini-2.0-flash",
      "input": 0.1,
      "output": 0.4,
      "cachedInput": null
    },
    {
      "name": "gemini-2.0-flash-lite",
      "input": 0.075,
      "output": 0.3,
      "cachedInput": null
    },
    {
      "name": "gemini-2.0-flash-001",
      "input": 0.1,
      "output": 0.4,
      "cachedInput": null
    },
    {
      "name": "gemini-2.5-pro-preview-tts",
      "input": 1.25,
      "output": 10,
      "cachedInput": null
    },
    {
      "name": "gemini-2.5-pro-preview-06-05",
      "input": 1.25,
      "output": 10,
      "cachedInput": null
    },
    {
      "name": "gemini-2.5-pro-preview-05-06",
      "input": 1.25,
      "output": 10,
      "cachedInput": null
    },
    {
      "name": "gemini-2.5-pro-preview-03-25",
      "input": 1.25,
      "output": 10,
      "cachedInput": null
    },
    {
      "name": "gemini-2.0-flash-lite-preview-02-05",
      "input": 0.075,
      "output": 0.3,
      "cachedInput": null
    },
    {
      "name": "gemini-2.0-flash-live-preview-04-09",
      "input": 0.5,
      "output": 2,
      "cachedInput": null
    },
    {
      "name": "gemini-embedding-001",
      "input": 0.15,
      "output": 0,
      "cachedInput": null
    },
    {
      "name": "gemini-1.5-flash-002",
      "input": 0.075,
      "output": 0.3,
      "cachedInput": null
    },
    {
      "name": "gemini-pro",
      "input": 0.35,
      "output": 1.05,
      "cachedInput": null
    },
    {
      "name": "gemini-1.5-pro-002",
      "input": 3.5,
      "output": 10.5,
      "cachedInput": null
    },
    {
      "name": "gemini-1.5-pro-exp-0801",
      "input": 3.5,
      "output": 10.5,
      "cachedInput": null
    },
    {
      "name": "gemini-pro-vision",
      "input": 0.35,
      "output": 1.05,
      "cachedInput": null
    },
    {
      "name": "gemini-gemma-2-27b-it",
      "input": 0.35,
      "output": 1.05,
      "cachedInput": null
    },
    {
      "name": "gemini-gemma-2-9b-it",
      "input": 0.35,
      "output": 1.05,
      "cachedInput": null
    },
    {
      "name": "gemini-2.5-flash-lite-preview-09-2025",
      "input": 0.1,
      "output": 0.4,
      "cachedInput": null
    },
    {
      "name": "gemini-2.5-flash-preview-09-2025",
      "input": 0.3,
      "output": 2.5,
      "cachedInput": null
    },
    {
      "name": "gemini-2.5-flash-lite-preview-09-2025",
      "input": 0.1,
      "output": 0.4,
      "cachedInput": null
    },
    {
      "name": "gemini-2.5-flash-preview-09-2025",
      "input": 0.3,
      "output": 2.5,
      "cachedInput": null
    },
    {
      "name": "gemini-2.5-flash-image",
      "input": 0.3,
      "output": 2.5,
      "cachedInput": null
    },
    {
      "name": "gemini-2.5-flash-image",
      "input": 0.3,
      "output": 2.5,
      "cachedInput": null
    },
    {
      "name": "gemini-embedding-001",
      "input": 0.15,
      "output": 0,
      "cachedInput": null
    },
    {
      "name": "gemini-live-2.5-flash-preview-native-audio-09-2025",
      "input": 0.3,
      "output": 2,
      "cachedInput": null
    },
    {
      "name": "gemini-live-2.5-flash-preview-native-audio-09-2025",
      "input": 0.3,
      "output": 2,
      "cachedInput": null
    },
    {
      "name": "gemini-3-pro-preview",
      "input": 2,
      "output": 12,
      "cachedInput": null
    },
    {
      "name": "gemini-3-pro-preview",
      "input": 2,
      "output": 12,
      "cachedInput": null
    },
    {
      "name": "gemini-3-pro-image-preview",
      "input": 2,
      "output": 12,
      "cachedInput": null
    },
    {
      "name": "gemini-3-pro-image-preview",
      "input": 2,
      "output": 12,
      "cachedInput": null
    },
    {
      "name": "gemini-2.5-computer-use-preview-10-2025",
      "input": 1.25,
      "output": 10,
      "cachedInput": null
    },
    {
      "name": "gemini-3-flash-preview",
      "input": 0.5,
      "output": 3,
      "cachedInput": null
    },
    {
      "name": "gemini-3-flash-preview",
      "input": 0.5,
      "output": 3,
      "cachedInput": null
    },
    {
      "name": "gemini-2.5-computer-use-preview-10-2025",
      "input": 1.25,
      "output": 10,
      "cachedInput": null
    },
    {
      "name": "gemini-robotics-er-1.5-preview",
      "input": 0.3,
      "output": 2.5,
      "cachedInput": null
    },
    {
      "name": "gemini-robotics-er-1.5-preview",
      "input": 0.3,